<?xml version="1.0" encoding="UTF-8"?>
<unit_weapon xmlns:xsi="http://www.w3.org/2001/XMLSchema-instance"
	xsi:noNamespaceSchemaLocation="validation/punkapocalyptic-config-unit-weapon-initial.xsd">
	<equipment>
		<unit>chief</unit>
		<constraints>
			<min_weapons>1</min_weapons>
			<max_weapons>2</max_weapons>
		</constraints>
		<weapon_selection>
			<weapon>
				<name>automatic_rifle</name>
			</weapon>
			<weapon>
				<name>crossbow</name>
			</weapon>
			<weapon>
				<name>mace</name>
			</weapon>
			<weapon>
				<name>medium_blade</name>
			</weapon>
			<weapon>
				<name>pistol</name>
			</weapon>
			<weapon>
				<name>rifle</name>
			</weapon>
			<weapon>
				<name>shotgun</name>
			</weapon>
		</weapon_selection>
	</equipment>
	<equipment>
		<unit>badass</unit>
		<constraints>
			<min_weapons>1</min_weapons>
			<max_weapons>2</max_weapons>
		</constraints>
		<weapon_selection>
			<weapon>
				<name>automatic_rifle</name>
			</weapon>
			<weapon>
				<name>crossbow</name>
			</weapon>
			<weapon>
				<name>mace</name>
			</weapon>
			<weapon>
				<name>medium_blade</name>
			</weapon>
			<weapon>
				<name>pistol</name>
			</weapon>
			<weapon>
				<name>rifle</name>
			</weapon>
			<weapon>
				<name>shotgun</name>
			</weapon>
		</weapon_selection>
	</equipment>
	<equipment>
		<unit>brute</unit>
		<constraints>
			<min_weapons>1</min_weapons>
			<max_weapons>2</max_weapons>
		</constraints>
		<weapon_selection>
			<weapon>
				<name>heavy_mace</name>
			</weapon>
			<weapon>
				<name>heavy_blade</name>
			</weapon>
			<weapon>
				<name>mace</name>
			</weapon>
			<weapon>
				<name>shield</name>
			</weapon>
			<weapon>
				<name>shotgun</name>
			</weapon>
		</weapon_selection>
	</equipment>
	<equipment>
		<unit>ganger</unit>
		<constraints>
			<min_weapons>1</min_weapons>
			<max_weapons>2</max_weapons>
		</constraints>
		<weapon_selection>
			<weapon>
				<name>crossbow</name>
			</weapon>
			<weapon>
				<name>bow</name>
			</weapon>
			<weapon>
				<name>light_mace</name>
			</weapon>
			<weapon>
				<name>mace</name>
			</weapon>
			<weapon>
				<name>medium_blade</name>
			</weapon>
			<weapon>
				<name>pistol</name>
			</weapon>
			<weapon>
				<name>rifle</name>
			</weapon>
			<weapon>
				<name>shotgun</name>
			</weapon>
			<weapon>
				<name>small_blade</name>
			</weapon>
			<weapon>
				<name>throwing_knives</name>
			</weapon>
		</weapon_selection>
	</equipment>
	<equipment>
		<unit>scumbag</unit>
		<constraints>
			<min_weapons>1</min_weapons>
			<max_weapons>2</max_weapons>
		</constraints>
		<weapon_selection>
			<weapon>
				<name>bow</name>
			</weapon>
			<weapon>
				<name>light_mace</name>
			</weapon>
			<weapon>
				<name>pistol</name>
			</weapon>
			<weapon>
				<name>small_blade</name>
			</weapon>
			<weapon>
				<name>throwing_knives</name>
			</weapon>
		</weapon_selection>
	</equipment>
</unit_weapon>